[
 {
  "applicability": "listed for First Semester 2026-27",
  "evidence": [
   "ev_40e21d6bfb0a"
  ],
  "source": "BIO F211",
  "target": "BIO C211",
  "type": "equivalence"
 },
 {
  "applicability": "listed for First Semester 2026-27",
  "evidence": [
   "ev_e8dc05e0e76d"
  ],
  "source": "BIO F212",
  "target": "BIO C241",
  "type": "equivalence"
 },
 {
  "applicability": "listed for First Semester 2026-27",
  "evidence": [
   "ev_74ef3d5b42a8"
  ],
  "source": "BIO F213",
  "target": "BIO C321",
  "type": "equivalence"
 },
 {
  "applicability": "listed for First Semester 2026-27",
  "evidence": [
   "ev_3a507b4e3a5d"
  ],
  "source": "BIO F215",
  "target": "BIO C331",
  "type": "equivalence"
 },
 {
  "applicability": "listed for First Semester 2026-27",
  "evidence": [
   "ev_e26a739fe25b"
  ],
  "source": "BIO F417",
  "target": "BIO C417",
  "type": "equivalence"
 },
 {
  "applicability": "listed for First Semester 2026-27",
  "evidence": [
   "ev_fcd045c4e3bb"
  ],
  "source": "BIO F418",
  "target": "BIO C418",
  "type": "equivalence"
 },
 {
  "applicability": "listed for First Semester 2026-27",
  "evidence": [
   "ev_e547a4d4eeae"
  ],
  "source": "BIO F421",
  "target": "BIO C421",
  "type": "equivalence"
 },
 {
  "applicability": "listed for First Semester 2026-27",
  "evidence": [
   "ev_19c9b9244015"
  ],
  "source": "BIO G510",
  "target": "PHA G510",
  "type": "equivalence"
 },
 {
  "applicability": "listed for First Semester 2026-27",
  "evidence": [
   "ev_18940e459a82"
  ],
  "source": "BITS F217",
  "target": "GS F212",
  "type": "equivalence"
 },
 {
  "applicability": "listed for First Semester 2026-27",
  "evidence": [
   "ev_f38e08e2d4ce"
  ],
  "source": "BITS F316",
  "target": "BITS C473",
  "type": "equivalence"
 },
 {
  "applicability": "listed for First Semester 2026-27",
  "evidence": [
   "ev_277d5b14617e"
  ],
  "source": "BITS F319",
  "target": "BITS C319",
  "type": "equivalence"
 },
 {
  "applicability": "listed for First Semester 2026-27",
  "evidence": [
   "ev_277d5b14617e"
  ],
  "source": "BITS F319",
  "target": "MBA C319",
  "type": "equivalence"
 },
 {
  "applicability": "listed for First Semester 2026-27",
  "evidence": [
   "ev_cd2bc6a7a9a2"
  ],
  "source": "BITS F320",
  "target": "MBA C320",
  "type": "equivalence"
 },
 {
  "applicability": "listed for First Semester 2026-27",
  "evidence": [
   "ev_cd2bc6a7a9a2"
  ],
  "source": "BITS F320",
  "target": "BITS C320",
  "type": "equivalence"
 },
 {
  "applicability": "listed for First Semester 2026-27",
  "evidence": [
   "ev_c5455ae2a40e"
  ],
  "source": "BITS F321",
  "target": "MBA C321",
  "type": "equivalence"
 },
 {
  "applicability": "listed for First Semester 2026-27",
  "evidence": [
   "ev_c5455ae2a40e"
  ],
  "source": "BITS F321",
  "target": "BITS C321",
  "type": "equivalence"
 },
 {
  "applicability": "listed for First Semester 2026-27",
  "evidence": [
   "ev_c22a6c303009"
  ],
  "source": "BITS F343",
  "target": "EA C482",
  "type": "equivalence"
 },
 {
  "applicability": "listed for First Semester 2026-27",
  "evidence": [
   "ev_168fa6cac585"
  ],
  "source": "BITS F372",
  "target": "EEE F346",
  "type": "equivalence"
 },
 {
  "applicability": "listed for First Semester 2026-27",
  "evidence": [
   "ev_168fa6cac585"
  ],
  "source": "BITS F372",
  "target": "BITS C372",
  "type": "equivalence"
 },
 {
  "applicability": "listed for First Semester 2026-27",
  "evidence": [
   "ev_3610e04a314e"
  ],
  "source": "BITS F385",
  "target": "BITS C385",
  "type": "equivalence"
 },
 {
  "applicability": "listed for First Semester 2026-27",
  "evidence": [
   "ev_41250dfc07db"
  ],
  "source": "BITS F415",
  "target": "EA C415",
  "type": "equivalence"
 },
 {
  "applicability": "listed for First Semester 2026-27",
  "evidence": [
   "ev_fc7b99e208c9"
  ],
  "source": "BITS F417",
  "target": "ME F423",
  "type": "equivalence"
 },
 {
  "applicability": "listed for First Semester 2026-27",
  "evidence": [
   "ev_fc7b99e208c9"
  ],
  "source": "BITS F417",
  "target": "EA C417",
  "type": "equivalence"
 },
 {
  "applicability": "listed for First Semester 2026-27",
  "evidence": [
   "ev_005fc6ad8905"
  ],
  "source": "BITS F431",
  "target": "EA C412",
  "type": "equivalence"
 },
 {
  "applicability": "listed for First Semester 2026-27",
  "evidence": [
   "ev_d69bcc925413"
  ],
  "source": "BITS F441",
  "target": "EA C441",
  "type": "equivalence"
 },
 {
  "applicability": "listed for First Semester 2026-27",
  "evidence": [
   "ev_17be881d02c0"
  ],
  "source": "BITS F444",
  "target": "EA C461",
  "type": "equivalence"
 },
 {
  "applicability": "listed for First Semester 2026-27",
  "evidence": [
   "ev_596eaadc1a6c"
  ],
  "source": "BITS F446",
  "target": "EA C471",
  "type": "equivalence"
 },
 {
  "applicability": "listed for First Semester 2026-27",
  "evidence": [
   "ev_13b43f0a7725"
  ],
  "source": "BITS F447",
  "target": "EA C473",
  "type": "equivalence"
 },
 {
  "applicability": "listed for First Semester 2026-27",
  "evidence": [
   "ev_0b68f8d8b237"
  ],
  "source": "BITS F448",
  "target": "EA C474",
  "type": "equivalence"
 },
 {
  "applicability": "listed for First Semester 2026-27",
  "evidence": [
   "ev_0b68f8d8b237"
  ],
  "source": "BITS F448",
  "target": "MBA C474",
  "type": "equivalence"
 },
 {
  "applicability": "listed for First Semester 2026-27",
  "evidence": [
   "ev_3927590ab7d9"
  ],
  "source": "BITS F449",
  "target": "EA C475",
  "type": "equivalence"
 },
 {
  "applicability": "listed for First Semester 2026-27",
  "evidence": [
   "ev_3927590ab7d9"
  ],
  "source": "BITS F449",
  "target": "MBA C475",
  "type": "equivalence"
 },
 {
  "applicability": "listed for First Semester 2026-27",
  "evidence": [
   "ev_3927590ab7d9"
  ],
  "source": "BITS F449",
  "target": "ECON F413",
  "type": "equivalence"
 },
 {
  "applicability": "listed for First Semester 2026-27",
  "evidence": [
   "ev_d48d4b5ea668"
  ],
  "source": "BITS F461",
  "target": "BITS C461",
  "type": "equivalence"
 },
 {
  "applicability": "listed for First Semester 2026-27",
  "evidence": [
   "ev_d48d4b5ea668"
  ],
  "source": "BITS F461",
  "target": "IS C341",
  "type": "equivalence"
 },
 {
  "applicability": "listed for First Semester 2026-27",
  "evidence": [
   "ev_37833313175b"
  ],
  "source": "BITS F462",
  "target": "BITS C462",
  "type": "equivalence"
 },
 {
  "applicability": "listed for First Semester 2026-27",
  "evidence": [
   "ev_63c84fc41b39"
  ],
  "source": "BITS F468",
  "target": "BITS C468",
  "type": "equivalence"
 },
 {
  "applicability": "listed for First Semester 2026-27",
  "evidence": [
   "ev_63c84fc41b39"
  ],
  "source": "BITS F468",
  "target": "ECON F415",
  "type": "equivalence"
 },
 {
  "applicability": "listed for First Semester 2026-27",
  "evidence": [
   "ev_5b6a5ec1f685"
  ],
  "source": "BITS F482",
  "target": "BITS C482",
  "type": "equivalence"
 },
 {
  "applicability": "listed for First Semester 2026-27",
  "evidence": [
   "ev_5b6a5ec1f685"
  ],
  "source": "BITS F482",
  "target": "MBA C482",
  "type": "equivalence"
 },
 {
  "applicability": "listed for First Semester 2026-27",
  "evidence": [
   "ev_5b6a5ec1f685"
  ],
  "source": "BITS F482",
  "target": "ECON F414",
  "type": "equivalence"
 },
 {
  "applicability": "listed for First Semester 2026-27",
  "evidence": [
   "ev_299de544bc00"
  ],
  "source": "BITS F488",
  "target": "BITS C488",
  "type": "equivalence"
 },
 {
  "applicability": "listed for First Semester 2026-27",
  "evidence": [
   "ev_299de544bc00"
  ],
  "source": "BITS F488",
  "target": "MBA C488",
  "type": "equivalence"
 },
 {
  "applicability": "listed for First Semester 2026-27",
  "evidence": [
   "ev_e4663a21dfe4"
  ],
  "source": "BITS F493",
  "target": "ECON F355",
  "type": "equivalence"
 },
 {
  "applicability": "listed for First Semester 2026-27",
  "evidence": [
   "ev_e4663a21dfe4"
  ],
  "source": "BITS F493",
  "target": "BITS C493",
  "type": "equivalence"
 },
 {
  "applicability": "listed for First Semester 2026-27",
  "evidence": [
   "ev_e4663a21dfe4"
  ],
  "source": "BITS F493",
  "target": "MBA C493",
  "type": "equivalence"
 },
 {
  "applicability": "listed for First Semester 2026-27",
  "evidence": [
   "ev_457b81ec57fa"
  ],
  "source": "BITS F494",
  "target": "BITS C494",
  "type": "equivalence"
 },
 {
  "applicability": "listed for First Semester 2026-27",
  "evidence": [
   "ev_457b81ec57fa"
  ],
  "source": "BITS F494",
  "target": "CE F434",
  "type": "equivalence"
 },
 {
  "applicability": "listed for First Semester 2026-27",
  "evidence": [
   "ev_26aa4e1b7b1f"
  ],
  "source": "CE F213",
  "target": "CE C392",
  "type": "equivalence"
 },
 {
  "applicability": "listed for First Semester 2026-27",
  "evidence": [
   "ev_987ffc3bc01e"
  ],
  "source": "CE F323",
  "target": "CE C414",
  "type": "equivalence"
 },
 {
  "applicability": "listed for First Semester 2026-27",
  "evidence": [
   "ev_b7f76f5d4ec7"
  ],
  "source": "CE F343",
  "target": "CE C381",
  "type": "equivalence"
 },
 {
  "applicability": "listed for First Semester 2026-27",
  "evidence": [
   "ev_d81eb7875d5f"
  ],
  "source": "CE F416",
  "target": "CE C416",
  "type": "equivalence"
 },
 {
  "applicability": "listed for First Semester 2026-27",
  "evidence": [
   "ev_900046a569ae"
  ],
  "source": "CE F420",
  "target": "CE G616",
  "type": "equivalence"
 },
 {
  "applicability": "listed for First Semester 2026-27",
  "evidence": [
   "ev_900046a569ae"
  ],
  "source": "CE F420",
  "target": "CE C422",
  "type": "equivalence"
 },
 {
  "applicability": "listed for First Semester 2026-27",
  "evidence": [
   "ev_0eca546d66c4"
  ],
  "source": "CE F423",
  "target": "CE C394",
  "type": "equivalence"
 },
 {
  "applicability": "listed for First Semester 2026-27",
  "evidence": [
   "ev_8be5c8a5df8e"
  ],
  "source": "CE F431",
  "target": "IS C472",
  "type": "equivalence"
 },
 {
  "applicability": "listed for First Semester 2026-27",